story_key,title_en,title_fr,title_med,source_files,segment_count,recommended_level,status,recommended_usage
young_man_and_lion,The Young Man and the Lion,Le jeune homme et le lion,Ta’ nguan nshum bo ngwayit,Francais_3.docx; frabcaise_3.xlsx,48,beginner_story,usable_after_review,"First story lesson; extract animal, village, forest, family, simple question dialogue."
creation_and_proverb,Creation and the Proverb,Création et proverbe,,Francais_3.docx; frabcaise_3.xlsx,39,advanced_culture,needs_adaptation,Cultural/proverb reading later; not MVP beginner content.
anta_and_mamadou,Anta and Mamadou,Anta et Mamadou,Anta bo Mamadou,Anta et Mamadou (1).docx,47,intermediate_story,needs_adaptation,"Values/story lesson: school, promise, truth, secrecy, family. Adapt for children before publishing."
who_can_help_me,Who Can Help Me?,Qui peut m'aider à mettre cette charge sur ma tête ?,wù ze b’a ywimd’àm nete lèt lé num tu àm à?,Francais_2 traduit (1).docx,39,beginner_story_after_alignment,needs_manual_alignment,"Repeated help/request pattern and animal vocabulary, but DOCX mixes French+Médumba in same paragraphs."
hunter_and_genie,The Hunter and the Spirit Who Stole Women,Le chasseur et le génie voleur de femmes,Ta’ nta’yoñ bo ta’ nziag yi mènnzwi,Francais_2 traduit (1).docx,41,advanced_story,needs_adaptation,Adventure story with more mature themes; keep for later/adult cultural reading.
